Original_Dialect,MSA_conversion
بيرفع الراجل   أوزان صغيرة بسرعة,يرفع الرجل  أوزانًا صغيرة بسرعة
راجل بينزل السلم.,رجل ينزل السلم.
رجال بيضايق التعبان بفار,رجل يستفز ثعبانًا باستخدام فأر
ست بتقطع شوية خضرة,أمراة تقطع بعض أوراق الشجر.
راجل قاعد وبيعزف على جيتار صغير,رجل يجلس ويعزف على جيتار صغير
طفل صغير بيشرب الميه في كوبايه.,طفل صغير يشرب الماء من كوب.
ست بتفقش بيضة في طاسة,امرأة تكسر بيضة في مقلاة.
راجل بيقص حصيرة.,رجل يقطع حصيرة.
راجل شايل حيون الظربان,رجل يحمل ظربان.
راجل بيقشر بصلة.,رجل يقشر بصلة.
واحد بيقطع حتة لحمة.,شخص  يقطع قطعة من اللحم.
راجل بيقلب الأكل,رجل يقلب الطعام.
اتنين بيتكلموا مع بعض.,اثنان يتحدثان  بعضهما مع بعض.
قطة تتمرجح على مروحة.,قطة تتأرجح على مروحة.
قطة بيضة بتلحس وتشرب اللبن المحطوط فالطبق,قطة بيضاء تلعق وتشرب الحليب الموضوع في طبق.
الرجالة بيجروا على الشط.,الرجال يركضون على الشاطئ.
راجل بيملا بطنه بالأكل,رجل يملأ  معدته بالطعام
الراجل بيعزف على الجيتار,الرجل يعزف على الجيتار.
حيوان موظ  بيشرب من خرطوم رشاش,حيوان موظ  يشرب من خرطوم رشاش
راجل بيتشقلب لورا على حلقة نط,رجل يتشقلب للخلف على منطة
راجل بيلاعب كلبين.,رجل يداعب كلبين.
رجل بيقطع جذع بفاس.,رجل يقطع جذعًا بفأس.
تلت رجالة بيلعبوا كاراتيه في ساحة,ثلاثة رجال يمارسون حركات الكاراتيه في ساحة
السباحات بيغوصو من منصة الانطلاق.,السباحات يغصن من منصة الانطلاق.
قطة بتلحس إزازة,قطة تلعق زجاجة.
ست بتقطع الخضرة,امرأة تقطع الأعشاب.
ست بتصب الزيت في حلة.,امرأة تصب الزيت في وعاء.
حصان بيقف,حصان يقف
ست بتقلب اللحمة في الحلة.,امرأة تقلب اللحم في وعاء.
ست حاطة مكياج.,امرأة تضع المكياج.
ست حاطة مكياج العيون,امرأة تضع ظلال العيون
قطة اصطادت قشة من طبق مياه,قطة اصطادت قشة من صحن الماء
راجل بيرقص في الشارع,رجل يرقص في الشارع.
رضيع بيمص السكاتة,طفل يمص السكاتة
الفار بياكل شوية البذور,الهامستر يأكل بعض البذور.
الست بترقص وتغني,المرأة ترقص وتغني.
راجل بيعمل عمليات سحب,رجل يجري عمليات سحب.
الست بتحط الزيت في القلاية,امرأة تضع الزيت في مقلاة.
عيل بيضحك,طفل يضحك.
الراجل بياكل الأكل,رجل يأكل طعاما.
السباحين بيتسبقوا في البحيرة,السباحون يتسابقون في بحيرة.
الراجل بيحط صلصلة الشوي على الفرخة,رجل يضع صلصة الشواء على الدجاج.
راجل راكب لوح تزحلق,رجل يركب لوح تزلج.
الطباخ بيقطع الفلفل الرومي شرايح,الطباخ يقطع الفلفل الرومي إلى شرائح.
الست بتفتح الدولاب,امرأة تفتح خزانة.
راجل بيقشر موزة,رجل يقشر موزة
طفلين  في الغابة وبيبصوا للكوخ,صبيان صغيران في غابة ينظران إلى الكوخ
عجلة  قدام الانقاض,دراجة بخارية أمام آثار قديمة.
راجل نايم على كرسي شايل عيل,رجل نائم على كرسي يحمل طفلاً.
قطة بيضة بتبص من الشباك,قطة بيضاء تطل من النافذة.
بنت واقفة لابسه بنطلون قصير وجزمة سودة جنب موتوسيكل أزرق,تقف فتاة ترتدي سروالًا قصيرًا وحذاءً أسود بجوار دراجة نارية زرقاء.
راجل ماشي بالعجلة لمدخل القهوة,رجل يمشي بالدراجة إلى فناء مقهى.
حمل لونه أبيض في أسود وعنده علامة في ودنه اليمين,حمل أبيض وأسود اللون مع علامة في أذنه اليمنى
بنت صغيرة لابسة خوذة عجلة مع عجلة من ورا,فتاة صغيرة ترتدي خوذة دراجة مع دراجة في الخلفية.
كنبة زرقة في الاوضة مع شروق الشمس,أريكة زرقاء في الغرفة مع شروق الشمس.
قطة بيضة واقفة على الأرض,قطة بيضاء تقف على الأرض.
كلبين وقطة مستريحين على الكنبة,كلبان وقطة يستريحان على الأريكة.
عجلة وقفة برا محل بيبيع كتب,دراجة متوقفة خارج محل لبيع الكتب.
قطة لونها أبيض في برتقالي ملفوفة ونايمة على كرسي جلد,قط لونه أبيض وبرتقالي يلتف وينام على كرسي جلدي.
اتنين صغيرين  قاعدين على الكنبة,زوجان شابان يجلسان على الأريكة.
شوية ناس قاعدين برا مبني مشرخ,مجموعة من الناس خارج مبنى متهالك.
اتنين ستات قاعدين على الكنبة  مستعدين للتصوير أدام الكاميرا,امرأتان تجلسان على الأريكة في وضع التصوير أمام الكاميرا.
راجل أفريقي حاط على ضهر  عربية صفرا مليانة للآخر,رجل أفريقي يتعلق بظهر شاحنة صفراء ممتلئة للغاية.
اتوبيس ماشي في طريق زحمة,حافلة تسير في طريق مزدحم.
كلب لونه دهبي قاعد في السرير بتاع القطط وبيبص للكاميرا,كلب برونزي اللون يجلس في سرير خاص بالقطط  وينظر للكاميرا
قطرين لونهم أخضر وأبيض واقفين على قضبان السكة الحديد,قطاران باللونين الأخضر والأبيض يقفان على قضبان السكك الحديدية
قطة رمادي على ترابيزة أكل,قطة رمادية على مائدة طعام.
راجل راكب على ضهر عربية دفع رباعي برتقالي,رجل يركب على ظهر سيارة دفع رباعي برتقالية.
راجل لابس قميص أحمر نايم على كرسي مع عيل  لسه مولود,رجل يرتدي قميصًا ورديًّا ينام على كرسي مع طفل رضيع.
صورة قريبة لوش نعامة,صورة مقربة لوجه نعامة.
عصفور واقف براس خضرة وصدر أبيض  على فرع الشجرة,وقف طائر برأس أخضر وصدر أبيض  على فرع شجرة.
راجل لابس  كاب راكب حصان أبيض,رجل يرتدي قبعة يركب حصانًا أبيض.
ست بتاخد صورة من فوق,امرأة تلتقط صورتها من أعلى.
ست لابسة قميص أحمر وهي مستعدة للتصوير في إعلان للبيرة,امرأة ترتدي قميصًا ورديًّا تتخذ أوضاعًا للتصوير في إعلان للبيرة
اتنين ستات هنديتين واقفين مع بنتين هنديتين على الشط,امرأتان هنديتان تقفان مع فتاتين هنديتين على شاطئ.
ترابيزه خشب وشمع وخمره وطبق بلاستيك فوشيا,طاولة خشبية عليها  شموع ونبيذ ووعاء بلاستيك أرجواني.
أتوبيس أبيض واقف على الخضرة قصاد المبنى,حافلة بيضاء متوقفة على العشب أمام المبنى.
راجل لابس مسك مضاد للتراب راكب موتوسكيل بتلت عجلات,رجل يرتدي قناعًا مضادًّا للاتربة يركب دراجة ثلاثية العجلات.
كلب لونه اسود في ابيض بيشم باب مقفول,كلب ذو لون أسود وأبيض يشتم بابًا مغلقا
عصفور واقف على فرع متغطي بالتلج,طائر صغير يقف على فرع مغطى بالثلج
طائر لونه أصفر بياكل فاكهة محطوطة في طبق أكل الطيور,طائر أصفر يأكل الفاكهة في وعاء تغذية الطيور
البط البني والأبيض ماشي على الزرع الأخضر,البط البني والأبيض يمشي على العشب الأخضر.
قطة أسود في أبيض واقفة قدام الشباك,قطة سوداء وبيضاء تقف أمام النافذة.
راجل لابس كاب  راكب حصان أبيض,رجل يرتدي قبعة يركب حصانًا أبيض.
عصفور واقف في طبق أكل الطيور النازل من جذع الشجرة,طائر صغير يقف على وعاء تغذية الطيور المتدلي من غصن الشجرة
في شوية ماشية سودة في أرض زراعية مع شجرة كبيرة في الضهر,توجد بعض الماشية السوداء في سهل عشبي مع شجرة كبيرة في الخلفية.
طيارة لونها أزرق وأحمر بتطير,طائرة ذات لون أزرق وأحمر أثناء الطيران
تلت رجالة بيأكلوا في  مطبخ,ثلاثة رجال يأكلون في مطبخ.
صورة قريبة لقطة نايمة على كنبة لونها كريمي,صورة مقربة لقطة على أريكة كريمية اللون
قطار واقف من محطة السكة الحديد,القطار واقف في محطة السكك الحديد
كلب قاعد على أرض مرصوف وبيبص لقطة على السور,كلب يجلس على الأرضية المرصوفة وينظر إلى قطة على السياج
بقرة بيضة بودنيين كبار بتبص للكاميرا,بقرة بيضاء بأذنين كبيرتين تنظر إلى الكاميرا.
تلات بنات شعرهم أسود غامق لابسين بناطيل بيضة وحمرة وسودة,ثلاث شابات داكنات الشعر يرتدين سترات بيضاء وحمراء وسوداء.
طير أبيض كبير ليه منقار برتقالي طويل واقف على الشط,طائر أبيض كبير بمنقار برتقالي طويل يقف على الشاطئ.
القطر  ماشي على قضبان في التلج,القطار يسير على القضبان في الثلج.
راكبين العجل بيعدوا كوبري تحت المطر,راكبو الدراجات يعبرون جسرًا تحت المطر.
اتوبيس  انجلترا احمر وابيض ماشي في الشارع,تسير حافلة إنجلترا حمراء وبيضاء في الشارع.
الطيور بتطير على ارتفاع قريب فوق المية,الطيور تطير على ارتفاع منخفض فوق الماء.
الطور الأسود في أبيض  بيبص للكاميرا,الثور الأسود والأبيض ينظر إلى الكاميرا.
شوية خيول بترعى في أرض زراعية,مجموعة من الخيول ترعى في الحقول العشبية.
ناس على موتوسكيلات في شارع من شوارع المدينة,الناس على دراجات نارية في أحد شوارع المدينة.
تلت خرفان اتصوروا من عربية وهما على طريق ترابي,ثلاثة خراف على طريق ترابي تم تصويرهم من سيارة
شوية ناس وقفين مع اتنين تانيين لابس زي القيس,مجموعة من الأشخاص يقفون مع شخصين آخرين يرتديان زي إلفيس
طير ابيض بيوجه عربية تسوق,طائر أبيض يوجه عربة تسوق.
رجال بيجدف بمركب أصفر ناحية الشط,رجل يجدف بزورق أصفر باتجاه الشاطئ.
صف من أزايز البيرة على الأرض,صف من زجاجات البيرة على الأرض.
اتنين ستات واقفين برا الاتوبيس,امرأتان تقفان خارج الحافلة.
خروف أبيض على نزلة الجبل بيبص للكاميرا,خروف أبيض على منحدر التل ينظر إلى الكاميرا.
القط الأسود  في أبيض بيبصو للكاميرا,القط الأسود والأبيض ينظر إلى الكاميرا.
بقرة لونها اسود وابيض واقفة في الزرع,بقرة سوداء وبيضاء تقف في الحقل.
اوضة المكتب فيها شوية مكاتب والحطيان لونها أخضر,غرفة مكتب بها عددة مكاتب ولها جدران خضراء
صورة بالأبيض والأسود لراجل في سيارة كلاسيكية وراجل بموتوسيكل كلاسيكية,صورة بالأبيض والأسود لرجل في سيارة كلاسيكية ورجل بدراجة نارية كلاسيكية.
تلاتة بيستعدوا علشان ينطلقو بمركب صغير,ثلاثة أشخاص يستعدون للانطلاق بقارب صغير.
بنت راكبة حصان لونه دهبي,فتاة تركب حصانًا برونزي اللون
مسابق جري  بيريح في الضل معاه إزازة مياة غازية,عداء يستريح في الظل مع زجاجة صودا.
قطة رصاصي نايمة على ترابيزة خشب,قطة رمادية مستلقية على طاولة خشبية.
بنت راكبة حصان بني,فتاة تركب حصانًا بنيًّا.
عربية فضي واقفة على جنب الطريق قصاد الجبال,سيارة فضية متوقفة على جانب الطريق أمام التلال.
راجل قاعد مربع رجليه وكان لابس حتة قماش لونها بني وماسك عصاية خشب,رجل يجلس متربعًا بينما يرتدي قطعة قماش بنية اللون ويمسك بعصا خشبية.
كلب قاعد تحت درجات السلم وجنبه كلب تاني واقف,كلب يرقد أسفل درجات سلم بجوار كلب آخر واقف.
مركب شراعية خشب هيكلها قديمة   واقفة عند رصيف المينا,سفينة شراعية خشبية قديمة الطراز متوقفة عند رصيف الميناء.
عبارة كبيرة قريبة من الساحل وفي وراها بيوت,عابرة محيطات بالقرب من الساحل ويوجد من خلفها منازل.
قطة بتبص من الشباك,قطة تنظر من النافذة.
كلب بيجري ورا تلت معيز,كلب يطارد ثلاث ماعز.
كلب دهبي قاعد على سجادة,جرو برونزي اللون  يستلقي على سجادة بيضاء.
كلب شعره طويل واقف في نجيلة وفيها  أشجارة كتير,كلب ذو شعر طويل يقف في منطقة عشبية وبها أشجارة كثيفة
قطر في المحطة,قطار في محطة.
الطير الأزرق واقف على الزرع الأخضر,الطائر الأزرق يقف على العشب الأخضر.
كرسي مكتب موجود في زاوية,كرسي مكتب شاغر في زاوية
أربع ستات واتنين رجالة قاعدين على ترابيزة طويلة في مطعم,أربع نساء ورجلان يجلسون على طاولة طويلة في مطعم.
شاب شعره لونه أحمر شايل عجلتين قريب من الشط,شاب أحمر الشعر يحمل دراجتين على مقربة من الشاطئ.
كنبة جلد وترابيزة خشب في غرفة المعيشة,أريكة جلدية وطاولة خشبية في غرفة المعيشة.
قطتين باصصين ناحية الشباك.,قطتان تنظران إلى نافذة.
كلب أبيض صغير لابس جاكت بيبص للكاميرا.,كلب أبيض صغير يرتدي سترة ينظر إلى الكاميرا.
اتنين ستات قاعدين على كراسي في محل,امرأتان تجلسان على كراسي في متجر.
اتنين ستات وطفل بيتصورو قصاد اوضة السفرة.,امرأتان وطفل يلتقطون صورة أمام غرفة الطعام.
مكان مكتب صغير ليه ضهر أخضر زاهي,حيز مكتبي صغيرة بجدران خضراء زاهية.
عربية خضرة واقفة بره الصالون.,سيارة خضراء متوقفة خارج الصالون.
شوية ناس قاعدين على طرابيزة مطعم.,مجموعة من الأشخاص يجلسون على طاولة مطعم.
الطيور بتعوم في الميه.,الطيور تسبح في الماء.
بقر سوداء وبيضاء ورا السور.,أبقار سوداء وبيضاء خلف سياج.
قطة قاعدة على الرملة بتبص للكاميرا.,قطة جالسة على الرمال تنظر إلى الكاميرا.
طيارة تجارية لونها اخضر في ابيض تقلع من المطار,طائرة تجارية ذات لون أخضر وأبيض تقلع من أرض الإقلاع
حصان بني في مزرعة خضرة.,حصان بني في حقل أخضر.
راجل كبير قاعد على الكنبه معاه لاب توب,رجل مسن  يجلس على الأريكة مع الحاسوب المحمول.
نسرين واقفين على فرع طويل,نسران يقفان على فرع طويل.
كوم كبير من خشب الخردة,كومة كبيرة من الخشب الخردة.
بنت راكبة حصان بني,فتاة تركب حصانًا بنيا.
صورة ابيض واسود لبقرة تحت شجرة,صورة بالأبيض والأسود لبقرة تحت شجرة.
كلب أسود واقف وسط موقع بناء.,كلب أسود يقف في منتصف موقع بناء.
اتنين ستات في قهوة,امرأتان تجلسان في مقهى.
راجل وطفل مشيين على طول الشط والبحر وراهم,رجل وصبي يمشيان على طول شاطئ والبحر في الخلفية.
القطة نايمة على بطانية مطبوع عليه حيوان.,القطة مستلقية على بطانية مطبوع عليها شكل حيوان.
موتوسيكلين على طريق ترابي.,دراجتان ناريتان على مسار ترابي.
رجل مبحلق في حصان شعره أبيض,رجل يحدق إلى حصان ذي شعر أبيض
قطة رمادية نايمة على طرابيزة خشب.,قطة رمادية مستلقية على طاولة خشبية.
موتوسيكل واقف جنب عربية.,دراجة نارية متوقفة بجانب سيارة.
نقله خشب فوقها كرسي,كومة من حطام خشبي Hعلاها كرسي
قطر ركاب الديزل بتاعه أصفر.,قطار ركاب بقاطرة صفراء.
قطر طويل واقف على القضبان,قطار طويل على القضبان
تلفزيون فيليبس بشاشة مسطحة  مع اتنين ريموت كنترول.,تلفزيون بشاشة مسطحة من فيليبس مع جهازي تحكم عن بعد.
قطة كاليكو قاعدة على سلم قدام الباب.,قطة كاليكو تجلس على درج أمام الباب.
في خروف أسود في أبيض يقف على النجيلة.,هناك خروف أسود وأبيض يقف على العشب.
أربعة  بيجدفوا  في الميه.,أربعة أشخاص يجدفون على زورق في الماء.
حصان بني في حقل أخضر.,حصان بني في حقل أخضر.
راجلين بيتكلموا قصاد طيارة صغيرة.,رجلان يتحدثان أمام طائرة صغيرة.
قطتان ، واحدة بني ، والتانية بيضاء نايمة على سرير.,قطتان ، واحدة بنية ، والأخرى بيضاء مستلقية على سرير.
قطر واقف في محطة القطر.,توقف قطار في محطة قطار.
قطر بني واقف على قضبان السكة الحديد,قطار بني واقف على قضبان السكك الحديدية
كلب أبيض في أسود باصص للكاميرا.,كلب أبيض وأسود ينظر إلى الكاميرا.
اتنين ستات في مركب شراعي.,امرأتان في مركب شراعي.
راجل بيبص لموتوسيكل أحمر.,رجل ينظر إلى دراجة نارية حمراء.
بقرتين  لونهم أبيض وأسود بيشربو من البركة.,بقرتان لونهما أبيض وأسود تشربان من البركة.
كلب لابس قميص أحمر مربوط بسلسلة حديد,كلب صغير يرتدي قميصًا ورديًّا مربوط بحاجز حديدي
صورة أبيض وأسود للكنبة مع شنطة متعلقة من ناحية واحدة,صورة بالأبيض والأسود لأريكة مع حقيبة يد معلقة بأحد طرفيها.
الطير الأزرق واقف على الزرع الأخضر.,الطائر الأزرق يقف على العشب الأخضر.
أربعة أشخاص ماشيين جنب فطر عملاق.,مجموعة من أربعة أشخاص يمرون بجوار فطر عملاق.
خروف على طرف الطريق مع بحيرة وجبل في الخلفية.,خروف على حافة طريق مع بحيرة وجبل في الخلفية.
ستة  قاعدين على ترابيزة قدامهم سلطة.,مجموعة من ستة أشخاص يجلسون على طاولة مع سلطة مقدمة لهم.
قطة بيضاء ورمادية في البانيو بتبص للكاميرا.,قطة بيضاء ورمادية في حوض الحمام تنظر إلى الكاميرا.
ست قاعدة على كنبة شايلة عيل.,امرأة تجلس على أريكة تحمل طفلاً.
كلبين بيلعبوا في التلج.,كلبان يلعبان في الثلج.
تلاتة قاعدين على طرابيزة في الهواء الطلق قدام مبنى ملون زي على بريطانيا,"
ثلاثة أشخاص يجلسون على طاولة في الهواء الطلق أمام مبنى مطلي بألوان علم بريطانيا"
كلب لابس طاقية بيجري في التلج,كلب يرتدي قبعة  يركض عبر الثلج.
بنت وعيل صغير واقفين جنب الغيتار والطبل.,طفلة وفتى صغير يقفان بجانب الجيتار والطبل.
اربعة كلاب تلعب ف التلج ووراهم منظر المدينة,أربعة كلاب تلعب في الثلج وخلفهم أفق المدينة.
طير بيطير فوق الميه,طائر يطير فوق الماء.
كلب شاحب بيجري على طول طريق ترابي.,يركض كلب شاحب على طول طريق ترابي.
راجل لابس مايوه لونه كستنائي بيتنطط على حبل في بحيرة,رجل يرتدي ثوب سباحة كستنائيًّا يتأرجح على حبل في بحيرة.
راجل نط في الميه من على صخرة,رجل يقفز من فوق صخرة في الماء
كلب بني في أبيض بيجروا على العشب.,كلب بني وأبيض يركض على العشب.
بنتين قاعدين على مركب رباعية الدفع امام الجسر,فتاتان تجلسان على مركبة رباعية الدفع على الرمال أمام جسر
راجل بيقدم عرض قدام ناس كتير.,رجل يقدم عرضًا أمام الكثير من الناس.
كلب بيجري في الغيط.,كلب يجري في حقل.
كلب أبيض بيجري في الميه.,كلب أبيض يجري عبر الماء.
كلب كبير ماشي على طول طريق مليان حصى في الغابة,كلب كبير يسير على طول طريق من الحصى في الغابة.
كلب أبيض في أسود بيلعب في التلج,كلب أبيض وأسود يمرح في الثلج.
الراجل اللي لابس الجاكت الازرق واقف وسط ناس كتير.,يقف الرجل ذو السترة الزرقاء وسط حشد من الناس.
كلب ذهبي في العشب وفي بؤه لعبة صفراء,كلب ذهبي يركض عبر العشب ولعبة صفراء في فمه.
عيل لابس قميص لونه أزرق وحاطط مكعبات خشب فوق بعضها,طفل صغير يرتدي قميصًا أزرق اللون يضع مكعبات خشبية بعضها فوق بعض
راجل وست وكلب ماشيين في طريق سالك,رجل وامرأة وكلب يسيرون في طريق ممهد.
طفل لابس جاكت  احمر بياكل قالب شوكلاتة,صبي صغير يرتدي معطفًا أحمر ويأكل قالب من الشوكولاتة.
الراجل رايح للميه,الرجل يذهب إلى الماء.
رجال الانقاذ بيفرجواعلى عيل بينط ف الميه,صبي يقفز في بركة بينما يشاهد رجال الإنقاذ.
الكلب الاصفر بيجري على الطريق الترابي,الكلب الأصفر يركض على الطريق الترابي
اربعة عيال قاعدين على كرسي بار عالي لونه أصفر ورمادي,أربعة أطفال يجلسون على مقاعد عالية  لبار أصفر ورمادي اللون
عيل وكلب بيجروا على الزرع,صبي وكلب يركضان على العشب
