Original_Dialect,MSA_conversion
دلوقتي هو محبوس وأنا حر. لو هعمل ده لوحدي، ممكن أبدأ دلوقتي. هي بتسرع وبتبطأ,الآن هو مسجون وأنا حر. إذا كنت سأفعل ذلك بمفردي، يمكنني أن أبدأ الآن. إنها تسرع وتتباطأ.
شيلا!,شيلا!
إحنا وقفنا ليه؟,لماذا توقفنا؟
أنا بس عايز أقف شوية. مش هتاخد ثانية.,أردت فقط أن أتوقف لبعض الوقت. لن يستغرق الأمر سوى ثانية.
إيه؟,ماذا؟
كنت عايز أسلم على أمي بسرعة.,أردت فقط أن ألقي التحية على أمي بسرعة.
أمك؟ مايلز بربك. إحنا المفروض نكون وصلنا هناك من ساعات.,أمك؟ مايلز بربك. كان من المفترض أن نكون هناك منذ ساعات.
عيد ميلادها بكرة. ومش معقول يعني إن أنا أكون معدي جنب بيتها ومسلمش عليها، صح؟,عيد ميلادها غدًا. ومن غير المعقول أن أمر بجانب منزلها ولا ألقي التحية عليها، أليس كذلك؟
سينتري قال إن أندرتون كان بيتفرج علي ده في مكان الإحتواء قبل ما يتم إتهامه مباشرة.,قال سينتري إن أندرتون كان يشاهد ذلك في مكان الاحتواء قبل أن يُتهم مباشرة.
عارف، هو جالي وقال لي عن البيانات المفقودة. كان فاكر إنك ممكن تلاقيه.,أعلم، لقد جاء إلي وتحدث عن البيانات المفقودة. كان يعتقد أنك قد تجدها.
أنا فعلا لقيتها. كانت جوه أجاثا الوقت دا كله. السؤال هنا ليه واحد عايز يمسحه من البيانات المحفوظة؟,لقد وجدتها بالفعل. كانت داخل أجاثا طوال هذا الوقت. والسؤال هنا هو، لماذا يريد أحدهم مسحها من البيانات المحفوظة؟
قول لي يا داني بتفكر في إيه.,قل لي يا داني، ماذا تفكر فيه؟
بفكر إن في حد فلت بجريمته.,أفكر في أن هناك شخصًا أفلت بجريمته.
إزاي؟,كيف؟
كل حاجة كويسة؟,هل كل شيء على ما يرام؟
كله كويس ما عدا حاجة واحدة. في حاجة لازم تعرفها قبل ما تمشي.,كل شيء على ما يرام، باستثناء شيء واحد. هناك شيء يجب أن تعرفه قبل أن تغادر.
أستاذ بلاين، أنا ما طلبتش منك تشرحلي حاجة.,أستاذ بلين، لم أطلب منك أن تشرح لي أي شيء.
أنا هروح أي مكان عشان دي هتفرق معاك بعد كده. إنت قلت إنك عارف موضوع إليسا معايا.,سأذهب إلى أي مكان من أجلك، لأن ذلك سيحدث فرقًا بالنسبة لك لاحقًا. لقد قلت إنك تعرف موضوع إليسا معي.
أيوه,نعم.
بس إنت متعرفش إنها كانت في بيتي لما كنت إنت هناك. جات هناك عشان جوابات العبور. مش كدا يا إليسا؟,لكنك لا تعلم أنها كانت في منزلي عندما كنت هناك. لقد جاءت هناك من أجل رسائل العبور. أليس كذلك يا إليسا؟
الله! جميل جدا.,يا إلهي! جميل جدًا.
فكرتني بيك عشان كدا اشتريتها. كلفتني أكتر من التنيين.,لقد ذكرتني بك، لذا اشتريتها. كلفتني أكثر من التنين.
ممكن ألبسها في شعري.,يمكنني ارتداؤها في شعري.
الله! مكنتش فاكرة إنها هتكون حلوة بالشكل ده. يا ريت كنت أقدر أوريها لأمي وأبويا. يا ريتك تقضي عيد الميلاد المجيد معانا.,يا إلهي! لم أكن أعتقد أنها ستكون جميلة هكذا. أتمنى لو أستطيع إظهارها لأمي وأبي. أتمنى أن تقضي عيد الميلاد معنا.
أنا وإنت هننبسط جدا في عيد الميلاد. ممكن أوريك هدية عيد الميلاد؟,أنا وأنت سنستمتع حقًا بعيد الميلاد. هل يمكنني أن أريك هدية عيد الميلاد؟
أيوة طبعا.,نعم، بالطبع.
بس في حاجة. هو هيتكلم معاك بس. مش عايزك تسأليه في حاجة وبلاش تبحلقيله.,لكن هناك شيء. هو الذي سيتحدث معك فقط. لا أريدك أن تسأله عن أي شيء ولا تنظر إليه.
إزاي هعرف أعمل مقابلة معاه وأنا مش عارف هسأله في إيه.,كيف يمكنني إجراء مقابلة معه إذا لم أكن أعرف ما سأسأله؟
دا أفضل حاجة هتخدها. أنا آسف.,هذا أفضل ما يمكنك الحصول عليه. أنا آسف.
ممكن أسألك سؤال؟ لو هو واقع في مشاكل، ليه بتخرجوه؟ ما هو ممكن يعملها تاني؟ بتحصل يعني.,هل يمكنني أن أسألك سؤالًا؟ إذا كان في ورطة، فلماذا تطلقون سراحه؟ أعني، يمكنه فعل ذلك مرة أخرى، أليس كذلك؟
هو حر. وقته خلص. دي القوانين. وعالجناه وقيمناه تاني ودلوقتي مفيش أي علامات ظهرت عليه.,إنه حر. لقد انتهى وقته. هذه هي القواعد. لقد عالجناه وقيّمناه مرة أخرى، والآن لا توجد أي علامات عليه.
علامات؟,علامات؟
علامات انتحارية. إحنا هنغير الضوء هنا لكارل. أتمني إنك شايف تقرأ.,علامات انتحارية. سنغير الضوء هنا لكارل. آمل أن تكون قادرًا على القراءة.
ده حالي. أنا عمري ما عرفت إني أكلت، عشان كدا أنا بأكل كميات صغيرة.,هذا حالي. لم أعرف أبدًا أنني أكلت، لذا فأنا آكل كميات صغيرة.
مش لازم تفتكر إنك جعان.,لا يجب أن تتذكر أنك جائع.
حاجة غريبة بس لو مأكلتش للحظة جسمك هيبطل يحس بالجوع. إنت متردد نوعا ما بس ما أدركتش إنك مأكلتش. هو أنا قلتلك علي سامي جانكيز؟,غريب، لكن إذا لم تأكل للحظة، فلن يشعر جسمك بالجوع. أنت متردد نوعًا ما، لكنك لم تدرك أنك لم تأكل. هل أخبرتك عن سامي جانكيز؟
أه أه، أنا سمعت عنه بما فيه الكفاية. قولي عن جون جي. إنت لسة فاكر إنه لسة هنا، صح؟,نعم، نعم، لقد سمعت عنه بما فيه الكفاية. أخبرني عن جون جي. ألا تزال تعتقد أنه لا يزال هنا، أليس كذلك؟
مين؟,من؟
الرجل اللي إنت بتدور عليه، جوني جي. عشان كدا إنت مروحتش، صح؟,الرجل الذي تبحث عنه، جوني جي. لهذا السبب لم تغادر، أليس كذلك؟
أهلا,مرحبًا.
مين هنا؟,من هناك؟
أنا الملك آرثر ودول فرسان الترابيزة المدورة. قلعة مين ده؟,أنا الملك آرثر وهؤلاء هم فرسان الطاولة المستديرة. لمن هذه القلعة؟
دي قلعة سيدي جاي دي لويمبارد.,إنها قلعة السير جاي دي لويمبارد.
لو سمحت روح قول لسيدك إن الإله كلفنا بمهمة مقدسة ولو هيرضي يدينا أكل ومأوي النهاردة، ممكن ينضم معانا في مهمتنا للكأس المقدسة.,من فضلك، اذهب وأخبر سيدك أن الله كلفنا بمهمة مقدسة، وإذا كان سيرضى أن يقدم لنا الطعام والمأوى اليوم، فيمكنه الانضمام إلينا في مهمتنا للكأس المقدسة.
ماشي هقول له، بس أظن إنه مش هيبقي متحمس، هو أصلا عنده واحدة، شايف؟,حسنًا، سأخبره، لكن أعتقد أنه لن يكون متحمسًا، فهو لديه واحدة بالفعل، أليس كذلك؟
إيه؟,ماذا؟
الرجل اللي هيشوفك راكع علي ركبتك! الضابط بويل كلايتون من تكساس.,الرجل الذي سيشاهدك راكعًا على ركبتيك! الضابط بويل كلايتون من تكساس.
خلي بالك أنا مبحترمش القانون، إنت إيه مشكلتك يعني؟,انتبه، أنا لا أحترم القانون، ما هي مشكلتك؟
إنت,أنت.
أه أنا خمنت كدا فعلا.,نعم، لقد خمنت ذلك بالفعل.
تعرف، إنت ممكن تكون فاكر إنك هتخرج من هنا بس أوعدك كل مرة تلف فيها هكون معاك زي خيالك.,تعلم، قد تعتقد أنك ستخرج من هنا، لكنني أعدك أنه في كل مرة تدور فيها، سأكون معك مثل خيالك.
لو نفسك حلو زي شخصيتك، أتمني دا. باي باي.,إذا كانت شخصيتك جيدة مثل مظهرك، فأتمنى ذلك. وداعًا.
إلين!,إلين!
تيد!,تيد!
أنا روحت البيت بدري ولقيت كراستك. أظن سيباها ليا أقرأها بعدين. إلين أنا عايز أتكلم معاكي.,لقد عدت إلى المنزل مبكرًا ووجدت كراستك. أعتقد أنك تركته لي لأقرأه لاحقًا. إلين، أريد التحدث معك.
أنا مش عاي زدا يطول أكتر من كدا.,لا أريد أن يطول هذا أكثر من ذلك.
أنا عارف إن الأمةر مكنتش حلوة من مدة طويلة بس الوضع هيكون مختلف لو صبرتي. أنا هظبط كل حاجة.,أعلم أن الأمور لم تكن جيدة منذ فترة طويلة، لكن الوضع سيكون مختلفًا إذا انتظرت. سأصلح كل شيء.
أنا صبرت جدا وكنت بحاول أساعد بس أنت مخلتنيش أعمل كدا.,لقد انتظرت كثيرًا وحاولت المساعدة، لكنك لم تدعني أفعل ذلك.
مبتحسش بأي حاجة ناحيتي خالص؟,ألا تشعر بأي شيء تجاهي على الإطلاق؟
في حاجات كتير بتخلي الحب يدوم أهمها الاحترام وأنا لا يمكن أعيش مع رجل أنا مبحترموش.,هناك أشياء كثيرة تجعل الحب يدوم، وأهمها الاحترام، ولا يمكنني العيش مع رجل لا أحترمه.
ميليندا من فضلك متقوليش لأي حد في المحل إن ألبير كان هنا النهاردة، ماشي؟,ميليندا، من فضلك لا تخبري أي شخص في المحل أن ألبرت كان هنا اليوم، هل هذا واضح؟
ليه؟,لماذا؟
ناس كتير قوي بتتكلم وبتطلع إشاعات في البلد. للأسف أنا عايز أحافظ علي أسرار حياتي.,الكثير من الناس يتحدثون وينشرون الشائعات في المدينة. للأسف، أريد الحفاظ على خصوصية حياتي.
تقصد إنكم مع بعض بالطريقة إياها؟,هل تقصد أنكما معًا بهذه الطريقة؟
أه.,نعم.
أظن إن كل اللي في المحل عارفين دا أصلا. واتكلموا عنه كتير. موريين ليدبيتر قالت قصة فظيعة عنك وليه مش مسموح لك تروح كنيسة بابتيست الأول تاني.,أعتقد أن الجميع في المحل يعرفون ذلك بالفعل. لقد تحدثوا عنه كثيرًا. قالت موريين ليدبيتر قصة فظيعة عنك ولماذا لا يُسمح لك بالذهاب إلى كنيسة بابتيست الأولى مرة أخرى.
أنت ناصح جدا. حقيقي كنت عايز أنصحك بحاجة.,أنت ذكي جدًا. أردت أن أنصحك بشيء.
نعم؟ تشرب كأس؟,نعم؟ هل تريد كأسًا؟
شكرا يا ريك. في تأشيرات خروج بتتباع في القهوة دي، بس إحنا عارفين إنك مبعتش ولا واحدة. دا السبب إن إحنا سامحين لك تفتحها.,شكرًا يا ريك. هناك تأشيرات خروج تباع في هذا المقهى، لكننا نعرف أنك لم تبع أيًا منها. هذا هو السبب في أننا سمحنا لك بفتحه.
أنا كنت فاكر إنها عشان بخليك تكسب في القمار.,اعتقدت أن هذا لأنك تجعلني أكسب في القمار.
دا سبب تاني. في رجل وصل كازابلانكا وفي طريقة لأمريكا، وهيعرضض مبلغ كبير لأي حد يبعله تأشيرة خروج.,هذا سبب آخر. هناك رجل وصل إلى كازابلانكا وفي طريقه إلى أمريكا، وسيعرض مبلغًا كبيرًا لأي شخص يبيعه تأشيرة خروج.
بجد؟ اسمه إيه؟,حقا؟ ما اسمه؟
فيكتور لازلو.,فيكتور لازلو.
فيكتور لازلو؟,فيكتور لازلو؟
أهلا لاف.,مرحبًا لاف.
تلاتين سنة من الاضطراب السياسي والاجتماعي وسقوط جدار برلين، ورئيسة وزراء لإنجلترا، وإلغاء أبارتايلد وحركة العاصفة والإجهاد.,ثلاثون عامًا من الاضطرابات السياسية والاجتماعية وسقوط جدار برلين، ورئيسة وزراء إنجلترا، وإلغاء أبارتايلد وحركة العاصفة والإجهاد.
مش مصدق إن ليباراتشي شاذ، البنات بتحبه. متوقعتش كدا أبدا.,لا أصدق أن ليباراتشي شاذ، الفتيات يعشقنه. لم أتوقع ذلك أبدًا.
باسل كان مهتم جدا يعرف أنت كنت فين البارح.,كان باسل مهتمًا جدًا بمعرفة أين كنت الليلة الماضية.
بلف ودور وبعمل عجايب وغرايب.,أتجول وأفعل المعجزات.
هقول له. بالمناسبة أنا قررت نخلي علاقتنا مهنية وبس.,سأخبره. على فكرة، قررت أن نجعل علاقتنا مهنية فقط.
ماشي في حاجات كتير لازم نعملها، ممكن تكون صعبة بالنسبة لك.,حسنًا، هناك أشياء كثيرة يجب أن نفعلها، وقد تكون صعبة بالنسبة لك.
صعبة بالنسبة لي؟ صعبة بالنسبة لي؟ صعبة بالنسبة لي؟ عندك أسئلة؟,صعبة بالنسبة لي؟ صعبة بالنسبة لي؟ صعبة بالنسبة لي؟ هل لديك أسئلة؟
أنا كلمت إدارة المدرسة، هو مش مدرس معتمد.,لقد تحدثت إلى إدارة المدرسة، إنه ليس مدرسًا معتمدًا.
دا كويس، إليود هو اللي بيدرس للفصل.,هذا جيد، إليود هو من يدرس الفصل.
إليود؟ طيب والأستاذة هيلير؟,إليود؟ حسنًا، وماذا عن الآنسة هيلير؟
قالت إن عندها حاجات أهم تعملها لما المول الجديد إتفتح.,قالت إن لديها أشياء أكثر أهمية للقيام بها عندما افتتح المركز التجاري الجديد.
اقعد عايز أقول لك حاجة.,اجلس، أريد أن أقول لك شيئًا.
أنا بخير.,أنا بخير.
هقول لك علي اللي بفكر فيه. أظن إن هي والمدير كولينز بيختلسوا فلوس من المدرسة بقالهم سنين.,سأخبرك بما أفكر فيه. أعتقد أن هي والمدير كولينز يختلسان أموال المدرسة منذ سنوات.
كل تلت شهور، فرقة جايمس جانج بتروح قريب من ليبرتي، ميزوري. دايما بيعملوا شغل قبل ما يرجعوا عشان يعملوا فلوس زيادة يدوها لعائلاتهم وأصدقائهم.,كل ثلاثة أشهر، تذهب فرقة جيمس جانج بالقرب من ليبرتي، ميزوري. دائمًا ما يؤدون عروضًا قبل أن يعودوا لجمع الأموال الإضافية لعائلاتهم وأصدقائهم.
بالإنجليزي يا بينكرتون.,باللغة الإنجليزية يا بينكرتون.
مفيش غير أربع بنوك في المنطقة متنهبوش.,هناك أربعة بنوك فقط في المنطقة لم يتم نهبها.
ممكن نحط الرجال في الأربعة؟,هل يمكننا وضع الرجال في الأربعة؟
مفيش داعي. أنا عندي حاجة تانية تحت تصرفي على بنك واحد بس.,لا داعي لذلك. لدي شيء آخر تحت تصرفي على بنك واحد فقط.
إيه هي؟,ما هو؟
ليه سبب الكره ده يعني.,لماذا كل هذا الكره؟
"مكنش لازم تعمل كده: رقم أربعة مع ابتسامة"".","لم يكن عليك فعل ذلك: ""الرقم أربعة مع ابتسامة""."
"مش الألبوم بتاعها اسمه "" رقم أربعة مع ابتسامة""؟","أليس ألبومها بعنوان ""الرقم أربعة مع ابتسامة""؟"
دا اللي أنا قولته.,هذا ما قلته.
"لا لا لا، إنت قلت ""الرقم أربعة مع ابتسامة"" قدام عنوان الألبوم.","لا لا لا، لقد قلت ""الرقم أربعة مع ابتسامة"" أمام عنوان الألبوم."
"إشارة لأجلة صينية في تورونتو وأعتقد أن في""ال"" بس ممكن أكون غلطان.","إشارة إلى مجلة صينية في تورونتو وأعتقد أن هناك ""ال"" لكن قد أكون مخطئًا."
ممكن تكون غلطان.,قد أكون مخطئًا.
ممتاز دا كان اختيارنا الأخير. هعمل إيه معاك؟,ممتاز، كان هذا اختيارنا الأخير. ماذا أفعل معك؟
ولا حاجة. (وهو بيقوم) شكرا لأنك جبتني هنا.,لا شيء. (وهو يقوم) شكرًا لجلبك لي هنا.
إنت رايح فين؟ أنت هتتجمد بره. أنت حتى مش لابس بالطو.,أين أنت ذاهب؟ أنت ستتجمد في الخارج. أنت لا ترتدي حتى معطفًا.
متخفش هتصرف.,لا تقلق، ستتدبر أمرك.
لا إنت كدا هتموت من البرد وهحس الذنب. أنا حاسة بالذنب فعلا عن ما كنت. عايز تشرب حاجة؟,لا، إذا بقيت هناك، فستموت من البرد وسأشعر بالذنب. أشعر بالذنب حقًا عما فعلته. هل تريد أن تشرب شيئًا؟
لا أنا كويس.,لا، أنا بخير.
أنا فاكر. ازيك يا روبيرتو!,أتذكر. كيف حالك يا روبيرتو!
فين الأوضة بتاعتك؟,أين غرفتك؟
معنديش.,ليس لدي.
معندكش أوضة؟ باولو؟ إيه اللي أنا سمعته ده؟,ليس لديك غرفة؟ باولو؟ ماذا أسمع؟
ماشي يا إنزو. هروح مكان تاني,حسنًا يا إنزو. سأذهب إلى مكان آخر.
مش بس جاكوس مايول صديق مميز جدا لكن كمان واحد من أفضل الغطاسين في العالم! وأنتو بتطردوه! إنت مجنون ولا إيه؟ غبي!,ليس جاكوس مايول صديقًا مميزًا جدًا فحسب، ولكنه أيضًا أحد أفضل الغواصين في العالم! وأنت تطردونه! ألا تعتقد أنك مجنون؟ غبي!
خلاص يا إنزو أنا هتصرف.,حسنًا يا إنزو، سأتدبر الأمر.
حبيبي، أنا هروح المول الصبح. تعرف محل اسمه ويككي. حبيبي بتدور علي إيه؟,حبيبي، سأذهب إلى المركز التجاري غدًا. هل تعرف متجرًا يسمى ويككي؟ حبيبي، ماذا تبحث عنه؟
الصندوق! الصندوق اللي حطيت ورقي فيه.,الصندوق! الصندوق الذي وضعت فيه أوراقي.
ورق إيه؟,أي أوراق؟
المستندات! الصور! الدليل!,المستندات! الصور! الدليل!
دليل إيه؟,دليل ماذا؟
حبيبي ركز معايا دقيقة بس. دليل كل عملية نصب خفيناه. الدليل اللي كان هيودينا ورا الشمس عشرين سنة.,حبيبي، ركز معي لدقيقة واحدة. دليل كل عملية احتيال قمنا بها. الدليل الذي كان سيؤدي بنا إلى السجن لمدة عشرين عامًا.
يعني أنت بتقول إنه مكنش كده إطلاقا,هل تقصد أنه لم يكن كذلك على الإطلاق؟
مش بالظبط. أقصد كان في حاجات أكتر من اللي قلتها لك.,ليس بالضبط. أعني، كان هناك المزيد من الأشياء أكثر مما أخبرتك به.
كريست، إنت ببساطة مشفتش اللي حصل. هم وقعوا الرزمة على الأرض وأنت خدتها.,كريست، أنت ببساطة لم تر ما حدث. لقد أسقطوا الرزمة على الأرض وأنت أخذتها.
أه أنا خدتها.,نعم، لقد أخذتها.
وبدأت أجري,وبدأت أركض.
وبدأت أجري,وبدأت أركض.
تفكير كويس.,تفكير جيد.
دا كل حاجة. أنا مفكرتش أنا عملت.,هذا كل شيء. لم أفكر في ما فعلت.
أنت عندك موهبة الوقوع في مشاكل، صح؟ وصلك كام؟,لديك موهبة الوقوع في المشاكل، أليس كذلك؟ كم حصلت؟
ست آلاف دولار. بالظبط خمس آلاف تمن مية وأربعة تاشر دولار.,ستة آلاف دولار. بالضبط خمسة آلاف وثمانمائة وأربعة عشر دولارًا.
يعني إنت سرقت الحرامية وهم دلوقتي بيدوروا عليك.,هذا يعني أنك سرقت اللصوص، والآن هم يبحثون عنك.
دا كله باختصار.,هذا كل شيء باختصار.
أه أنت لاوم تكون مجنون عشان تعمل اللي عملته ده. لو عايز رأيي، لازم ترجع الفلوس تاني للرجل. رجعهاله واعتذر له.,أنت يجب أن تكون مجنونًا لفعل ما فعلته. إذا أردت رأيي، يجب أن تعيد المال إلى الرجل. أعده واعتذر له.
لا طبعا. مستحيل أرجع له الفلوس. دي بقت فلوسي أنا دلوقتي.,لا، بالطبع لا. من المستحيل أن أرجع له المال. إنها أموالي الآن.
لو عرف مكانك هيأذيك.,إذا عرف مكانك، فسيؤذيك.
الفلوس دي مستقبلي كلها.,هذا المال هو مستقبلي بأكمله.
خليك كدا وانت مش هيبقي لك مستقبل أصلا. هتموت وعندك سبعتاشر سنة,استمر هكذا ولن يكون لديك مستقبل على الإطلاق. ستموت عندما يكون عمرك سبعة عشر عامًا.
قابلت دكتور شيا إزاي؟,كيف قابلت الدكتور شيا؟
كانوا مجموعة محاضرات في علم النفس في الجامعة. رحت وسمعته بيتكلم وعجبتني فكرة اصطياد العفاريت.,كانت هناك سلسلة من المحاضرات حول علم النفس في الجامعة. ذهبت واستمعت إليه يتحدث وأعجبتني فكرة صيد الأشباح.
لازم أعترف إني شكاك. لحد دلوقتي.,يجب أن أعترف أنني شكاك. حتى الآن.
أنا كمان. التحقيق مبيطلعش أكتر من مرة.,أنا أيضًا. لا يظهر التحقيق أكثر من مرة.
أظن إن الموضوع كله كان غريب بالنسبة لك زي ما هو غريب بالنسبة لي.,أعتقد أن الموضوع بأكمله كان غريبًا بالنسبة لك كما هو غريب بالنسبة لي.
فعلا كان غريب.,نعم، كان غريبًا.
الدنيا ضلمة مش هنعرف نرجع دلوقتين خلينا ننام هنا ونكمل بكرة الصبح.,إنها مظلمة، ولا يمكننا العودة الآن، دعنا ننام هنا ونكمل غدًا صباحًا.
طيب والدهب؟,حسنًا، وماذا عن الذهب؟
ماله؟,ماذا به؟
لازم نتفرق دلوقتي.,يجب أن ننفصل الآن.
إحنا بدأنا ده مع بعض وهنكمل مع بعض مفيش داعي نتفرق دلوقتي.,لقد بدأنا هذا معًا وسنكمله معًا، لا داعي للانفصال الآن.
طيب وفيها إيه لما نتفرق؟ عايز أضمن نصيبي لو حاجة حصلت.,حسنًا، وماذا لو انفصلنا؟ أريد ضمان نصيبي إذا حدث شيء ما.
مش أنت تشارلز بالانتاين اللي مترشح؟,ألست تشارلز بالانتاين المرشح؟
أه أنا.,نعم، أنا.
أنا من أشد مؤيدينك وبقول لكل اللي بيركبوا معايا إنهم لازم يصوتوا لك.,أنا من أشد مؤيديك وأخبر كل من يركب معي أنهم يجب أن يصوتوا لك.
