Original_Dialect,MSA_conversion
يعطيكم الله الف عافية. ماشاء الله اصحابى كانوا هناك و قالولي انه كل شي كان ممتاز . انا كنت جاية بس تعبت والماتش كان تحفة .,يعطيكم الله ألف عافية. ما شاء الله، أصدقائي كانوا هناك وقالوا لي إن كل شيء كان ممتازاً. أنا كنت جاية بس تعبت، والماتش كان تحفة.
طيب خلوه يكمل .نضحك شويا .,طيب، دعوه يكمل. دعونا نضحك قليلاً.
المحشي طالع ني .,المحشي طالع ني.
رعب يا حيوان.منك لله. الفيلم طلع رعب.,رعب يا حيوان. منك لله. الفيلم طلع رعب.
ليه كده يوم ما بقينا اصحاب .بعدتنا الدنيا.,لماذا هكذا يوم ما أصبحنا أصدقاء. بعدتنا الدنيا.
امتى هنفكنا من الناس السايسة دى.,متى سنفك أنفسنا من الناس السايسة هذه؟
فينك يا بطاطسايتي .,أين أنت يا بطاطسيتي؟
لن اتنازل .ولن اتزحزح .اعتقد ده ملخص خطاب مبارك .,لن أتنازل. ولن أتزحزح. أعتقد أن هذا ملخص خطاب مبارك.
لما بتيجي تشتكي للناس. بيفضحوك.,عندما تأتي لتشكو للناس. يفضحونك.
من عجائب مجتمعنا اذا حصل لغيرهم مصيبه قالوا عقآب ، و إذا حصلهم شيء قالوا عين وصابتنا .,من عجائب مجتمعنا، إذا حدثت مصيبة لغيرهم قالوا عقاب، وإذا حدث لهم شيء قالوا عين وصابتنا.
اوف بيعملوا حاجة فى الفرن ريحتها تحفة .راح الدايت .,أوف، يفعلون شيئاً في الفرن، رائحته تحفة. راح الدايت.
لا اجبر احد بالدخول ولكن الاكتفاء بالمتابعه . للاسف لان الاغلب مبتدئين .,لا أجبر أحداً على الدخول، ولكن الاكتفاء بالمتابعة. للأسف لأن الأغلب مبتدئون.
بعضهم يتركون من حولنآ ذرآت من آلحنين. نتنفسهآ حتى بغيآبهم .,بعضهم يتركون من حولنا ذرات من الحنين. نتنفسه حتى بغيابهم.
بنت اللذينة عملت كل ده امتى . يخربيتك .,بنت اللذينة عملت كل ده امتى. يخربيتك.
قمر اوى امير كرارة .والبرنامج بتاعه حلو جدا .,قمر جداً أمير كرارة. والبرنامج بتاعه حلو جداً.
ياريت والله. للاسف البرنامج كله رقص .,يا ريت والله. للأسف البرنامج كله رقص.
العرب مبيعرفوش غير الغنى والرقص .,العرب لا يعرفون غير الغنى والرقص.
حتى العيال الصغيرة بقى ليها اراء سياسية. اه يانى .,حتى الأطفال الصغار أصبح لهم آراء سياسية. آه يا أنا.
كل ما اكتبه هنا بيعبر عن رائى الشخصى .مش راى حد تانى .,كل ما أكتبه هنا يعبر عن رأيي الشخصي. مش رأي حد تاني.
نفسي اكون مكان فيفي عبده . واشتغل رقاصة فى الكبارية .,نفسي أكون مكان فيفي عبده. وأشتغل رقاصة في الكبارية.
الحب ده حاجة جميلة جدا . بس انتم اللى مش بتفهموا .,الحب ده حاجة جميلة جداً. بس أنتم اللي مش بتفهموا.
يا خراشى على جمال امبر كرارة .,يا خراشي على جمال أميرة كرارة.
اصعب شي تنتظر من شخص يعتذر لخطاء ارتكبه تجاهك . ويطول الانتظار ويزيد من غلطة . شعور سيء .,أصعب شيء تنتظر من شخص يعتذر لخطأ ارتكبه تجاهك. ويطول الانتظار ويزيد من الخطأ. شعور سيء.
اشتقت لمواقف ولحظات لايفهمهآ احد الا أنا وأنت .,اشتقت لمواقف ولحظات لا يفهمها أحد إلا أنا وأنت.
انت مع جماهير الاهلي اوعى تقول مع الزمالك . هزعل .,أنت مع جماهير الأهلي، لا تقل إنك مع الزمالك. سأزعل.
ليس هناك أذكى من أن تكون غبيا في الوقت المناسب. .,ليس هناك أذكى من أن تكون غبياً في الوقت المناسب.
احن لاشياء اعلم جيدا آن حنيني لهآ لن يعيدهآ .,أحن لأشياء أعلم جيداً أن حنيني لها لن يعيدها.
يا حظ فيفي عبده الحلو .,يا حظ فيفي عبده الحلو.
بعشق قصايد كاظم الساهر .,أعشق قصائد كاظم الساهر.
صدق الي قال اللى يستعجل الامور قبل اوانها .اتعاقب بحرمانها .,صدق من قال إن الذي يستعجل الأمور قبل أوانها. يُعاقب بحرمانها.
أنآ حقا أريد العودة إلى ذلك الوقت الذي كآن فيه جدول الضرب اجمل شيء في العآلم .,أنا حقاً أريد العودة إلى ذلك الوقت الذي كان فيه جدول الضرب أجمل شيء في العالم.
من لا يرحم والديه. لا ينتظر رحمه احد .,من لا يرحم والديه. لا ينتظر رحمة أحد.
حاجه وحشه اوي لما ابوك ياخد من مامك الاكل.,شيء سيء جداً عندما يأخذ أبوك من أمك الأكل.
الحنين ؛ هو حكآيات لآنستطيع كتابتهآ .,الحنين هو حكايات لا نستطيع كتابتها.
بنت تغني راب ورجال يرقص باليه راحو الرجاله .,بنت تغني راب ورجال يرقصون باليه. راح الرجال.
ان العين لتدمع والقلب ليحزن وان عشاق اليل يعزفون .,إن العين لتدمع والقلب ليحزن وإن عشاق الليل يعزفون.
ابن عمي عدو سنتين مبيقدرش يقوم من علي لسرير.,ابن عمي عدو سنتين، لا يقدر أن يقوم من على السرير.
فاكر زمان لم كنا بنلعب ف الشارع و نجري ورا بعض .,أتذكر زمان عندما كنا نلعب في الشارع ونركض وراء بعض.
جواك كلام كثير ومتضايق ومش قادر تقوله او تشرحه للشخص اللي متضايق منه .,جواك كلام كثير ومتضايق ومش قادر تقوله أو تشرحه للشخص اللي متضايق منه.
اكره الدبان اللي يقعد يزن بالليل ده .,أكره الذباب الذي يظل يطن بالليل هكذا.
الجلوس مع الاطفال شئ جميل و مفرح .,الجلوس مع الأطفال شيء جميل ومفرح.
تصبحوا علي حاجه شبهكوا .,تصبحوا على شيء يشبهكم.
ليه يفوتني المسلسل كل مره .,لماذا يفوتني المسلسل كل مرة؟
احساس وحش اوى لما تكون بتتكلم مع حد و هو اصلا مش معاك .,إحساس سيء جداً عندما تكون تتحدث مع شخص وهو أصلاً مش معاك.
بزعل اوى لما اكون باكل والبيبسى يخلص قبل الاكل .ابلع بايه انا .,أزعل جداً عندما أشرب البيبسي قبل الأكل. ماذا أفعل الآن؟
شيء أريد امتلاكه. تذكره سفر الي مصر .,شيء أريد امتلاكه. تذكرة سفر إلى مصر.
الواحد بقى عنده الجاعه يرحل عن ناس كان متمسك بيهم زمان .,الجوع الآن يدفعنا للرحيل عن أشخاص كنا متمسكين بهم في الماضي.
نجلاء بدر جمال ربانى .,نجلاء بدر جمالها رباني.
رامز ده هيموت حد من الممثلين فى مرة اقسم بالله.,رامز هذا سيقتل أحد الممثلين في يوم من الأيام، أقسم بالله.
غلاسة و رخامة فعلا .,غِلاسة ورخامة فعلاً.
مهمآ بلغ فينآ النضج . نحن في حقيقة آلأمر أطفال دآئمون آلإحتيآج الى حضن يضمنآ .,مهما بلغ نضجنا، فنحن في حقيقة الأمر أطفال دائمون الاحتياج إلى حضن يضمنا.
شكلها حلوة الحلقة . التعليقات مضحكة .,يبدو أن الحلقة جميلة. التعليقات مضحكة.
ده احنا بنشقى يا جدع .,إننا نتعب كثيراً يا رجل.
مسائكم نسيان لكل ذكرى آرهقتكم .,مساؤكم نسيان لكل ذكرى أرهقتكم.
اشتقت للشعور الجميل اللي يقولي بكرا القبض .,اشتقت لذلك الشعور الجميل الذي يقول لي غداً الراتب.
في هذآ آلمسآء أتمنى للبنات. فرحه تحول آسمآئهم من بنت فلان إلى حرم علان ويتورط علان ويرتآح فلان .,أتمنى للبنات في هذا المساء فرحة تغير أسمائهن من بنت فلان إلى حرم علان، فيتورط علان ويرتاح فلان.
البنات يغنون راب والشباب يرقصون باليه . راحوا الطيبين .,البنات يغنون راب والشباب يرقصون باليه. راحوا الطيبين.
اكتب حاجه تاخد عليها حسنات .,اكتب شيئاً تأخذ عليه حسنات.
الف مبروك للعريس اانهاردة اجمل ليلة وهنولعها علشانه .,ألف مبروك للعريس، الليلة أجمل ليلة وسنحتفل من أجله.
صاحبك اللي بجد هيجيلك من غير ما تطلبه ده اللي تحافظ عليه بجد .,صديقك الحقيقي هو من يأتيك دون أن تطلب منه، هذا من يجب أن تحافظ عليه حقاً.
والله شاطرين .,والله شاطرين.
اكيد هيجي يوم واحب المذاكرة واذاكر زي الناس العباقرة .,أكيد سيأتي يوم وأحب المذاكرة وأذاكر مثل الناس العباقرة.
هتتعوض قريب ان شاء الله.,ستتعوض قريباً إن شاء الله.
اللهم اجبر خواطرنا جبراً يليقُ بعظيم رحمتك .,اللهم اجبر خواطرنا جبراً يليق بعظيم رحمتك.
استلمني صداع عنيف . ما مشيش حتى بعد ماضربت قهوة .,أصبت بصداع شديد. لم يذهب حتى بعد أن شربت القهوة.
كفاية اتعقدنا بقى .عايزه اعمل شعرى زيك . اعمل ايه .,كفاية، تعقدنا! أريد أن أصبغ شعري مثلك، ماذا أفعل؟
يازمن الأقنعه فين الوجه، كل يوم يسقط لأصحآبي قناع .,يا زمن الأقنعة، أين الوجه الحقيقي؟ كل يوم يسقط قناع لأصحابي.
بأي حق تعلقني بيك وتغيب .,بأي حق تُعلقني بك ثم تغيب؟
أمنيتي أكون عازفة بيانو محترفه .,أمنيتي أن أكون عازفة بيانو محترفة.
معقوله تنساني .,معقولة تنساني؟
قال بيقولك بحب اصحابى .يخربيتك يا رامز يغور الحب ده .,قال يقولك بحب أصحابي. يخرب بيتك يا رامز، يغور الحب ده.
اشتهي سوراً اجلس على حافته و حيده، طفلة حافية القدمين .احدق في عيون العابرين وابتسم للغرباء .,اشتهي سوراً أجلس على حته، طفلة حافية القدمين، أحدق في عيون العابرين وابتسم للغرباء.
كلمتين وبس. عايزة اجازة .,كلمتين وبس، أريد إجازة.
فيا تعب مش طبيعي .,يا له من تعب غير طبيعي.
العين ولهانه على وجودك يا فلان .,العين مشتاقة لرؤيتك يا فلان.
البيت من غير ابويا وامي ميسواش حاجة .,البيت من غير أبي وأمي لا يساوي شيئاً.
"والله مش هأحب وأشتآق , كل مآ حبينآ حد وتعلقنآ فيييه فارقناه .",والله لن أحب وأشتاق، كلما أحببنا أحداً وتعلقنا به، فارقنا.
كل الامهات كدا مهما اتنرفزوا مننا بس هيفضل جواهم حتة حنية مش هتروح مهما عملنا .,جميع الأمهات هكذا، مهما غضبوا منا، لكن بداخلهم قطعة حنان لن تختفي مهما فعلنا.
خليك طبيبعي وخليك صريح ومتلبسش اكتر من وش علشان ترضي حد .,كن طبيعياً وصريحاً ولا ترتدي أقنعة لإرضاء الآخرين.
ما هو لازم اليوم يقفل صح اهو حاجة تليق بانجازاتي باقي اليوم .,لا بد أن ينتهي اليوم بشكل جيد، شيء يليق بإنجازاتي.
ميهمنيش شكلك علي قد ما يهمني طريقه تفكيرك .,لا يهمني شكلك بقدر ما يهمني طريقة تفكيرك.
حنيت له والقلب بالبعد ملزوم .,حنيت له والقلب من البعد ملزوم.
الضرب اشتغل على مظاره العباسية دلوقتى .,الضرب بدأ في مظاهرة العباسية الآن.
عايزة اعمل اي حاجة مجنونة ومليش نفس .مستنية الدافع و اتأخر عليا .,أريد أن أفعل أي شيء مجنون، لكن ليس لدي دافع.
السكوت احيانا من باب االعفو . و العفو لا يملكه غير الكرماء .,السكوت أحياناً من باب العفو، والعفو لا يملكه إلا الكرماء.
عندما نفتقد أحدهم . تتغير عاداتنا تمآما . نلتزم الصمت كثيرا و نتألمم .,عندما نفتقد أحداً، تتغير عاداتنا تماماً، نلتزم الصمت كثيراً ونتألم.
قمة العذآب النفسي آنك تشوف نآس مآ تعرفهمش ويتكلموا عن موضوع بفكر خطأ. بتبقى مش عارف تقنعهم ازاى .وتدخل فى جدال لا متناهى .,قمة العذاب النفسي أن تشاهد أشخاصاً لا تعرفهم يتحدثون عن موضوع ما بفكرة خاطئة، ولا تعرف كيف تقنعهم، وتدخل في جدال لا نهاية له.
نفسي أرسم .,أريد أن أرسم.
امتى هشوفك بس .كل مرة نتفق ونكنسل .,متى سأراك؟ كل مرة نتفق ونلغي.
مع انى عارفة انك سراب . بس مش عارف ليه لحد دلوقتي بمشى وراك . وانا عارفة ان العذاب هيجى من وراك .,مع أني أعرف أنك سراب، لكن لا أعرف لماذا ما زلت أسير خلفك، وأنا أعرف أن العذاب سيأتي بسببك.
لما اشوف البرنامج ده .اؤمن بأننا من دول العالم الثالث .,عندما أشاهد هذا البرنامج، أؤمن بأننا من دول العالم الثالث.
الوفاء هو اعظم ما تتحلى به النفس البشريه . هو ذاك الطبع الذي يعتبره البعض نادرا في زمننا المليء بالجمود والنكران .,الوفاء هو أعظم ما تتحلى به النفس البشرية. هو ذلك الطبع الذي يعتبره البعض نادراً في زمننا المليء بالجمود والنكران.
امي طردتني عشان مسلسل سلسلال الدم مع العلم انها شافتوا كتير.,أمي طردتني بسبب مسلسل سلسال الدم، مع أنها شاهدته كثيراً.
أمتى يجيبوا تلفزيون فى الصالة .,متى سيحضرون تلفزيوناً في الصالة؟
تعبت خلاص .,تعبت جداً.
اكثر شي يذبحني اني انتظر .,أكثر شيء يؤلمني هو الانتظار.
يآرب يا ستآر . طمنونا على ابو تريكة .,يا رب يا ستار. طمئنونا على أبو تريكة.
الاصابة جاتلى فى الركبة. ربنا يستر .,الإصابة في ركبتي. يا رب استر.
بعض الغياب يعلمك كيف تشتاق . وبعض الغياب يعلمك ازاى تقسى .,بعض الغياب يعلمك كيف تشتاق، وبعض الغياب يعلمك كيف تقسو.
انا فله شمعه منوره .,أنا فلة شمعة منورة.
تركت له رساله. سأعود عندما تشعر بغيابى.,تركت له رسالة: سأعود عندما تشعر بغيابي.
حاجة مؤثرة جدا عندمآ لآ يشعر من نحب بغيآبنآ .هذآ يعني آنه لم يشعر بحضورنآ .,شيء مؤثر جداً عندما لا يشعر من نحب بغيابنا. هذا يعني أنه لم يشعر بحضورنا.
احيانا اسلوب الناس في الكلام بيبينلك قد ايه انت راقي .,أحياناً أسلوب الناس في الكلام يبين لك مدى رقيك.
الصديق الجدع هو اللي يوقف يطبخلك يوم الخميس .,الصديق الجدع هو من يطبخ لك يوم الخميس.
الواحد بيحاول يتجاهل ويعمل نفسه اعمى عن حاجات كتيرة اوي بتحصل في حياته لمجرد إنه عنده أمل فى إنها تتصلح وان حياته تكون احسن.,يحاول الإنسان أن يتجاهل ويتظاهر بالعمى عن أشياء كثيرة تحدث في حياته لمجرد أنه يأمل أن تتحسن الأمور وأن حياته ستكون أفضل.
اذا البرنامج ساعتين .اتوقع الاعلانات ساعة ونص .,إذا كان البرنامج ساعتين، أتوقع أن الإعلانات ستكون ساعة ونصف.
بعض البشر يقولوا لنا ان نتكلم معهم بصدق و صراحة تامة ، و عندما نعمل ما يقولون . يؤلمنا الحديث معهم . موش انتم اللى طلبتوا في البداية .,بعض البشر يطلبون منا أن نتحدث معهم بصدق وصراحة تامة، وعندما نفعل ما يقولون، يؤلمنا الحديث معهم. ألم تطلبون ذلك في البداية؟
‏‏الكلام أثناء البكاء .هو أصدق كلام ينطقه الانسان .,الكلام أثناء البكاء هو أصدق كلام ينطقه الإنسان.
جميل شعورهم بالإنجاز سوا .,شعور جميل أنهم يشعرون بالإنجاز معاً.
لاخر نفس فيا بنادي . يارب مشيلش السنادي .,حتى آخر نفس في أنادي، يا رب لا تأخذ روحي.
أنا متضايق جدا .بسبب تضييع الوقت .,أنا متضايق جداً بسبب ضياع الوقت.
أخاف من فرقآك والبعد ممقوت . وأشفق على قربك وأحبك وأخاف عليك .,أخاف من فراقك والبعد مكروه. وأشفق من قربك وأحبك وأخاف عليك.
ايه رايكم فى المقال بتاعى بتكلم فيه عن الاصلاح .,ما رأيكم في مقالي الذي أتحدث فيه عن الإصلاح؟
شوفوا الرشاقه يابناتنا .,انظروا إلى الرشاقة يا بناتنا.
نفسي اتعلم كاراتييه .,أريد أن أتعلم الكاراتيه.
حاسة ان البنت داخت وهتقع .,أشعر أن البنت ستدوخ وتقع.
بدأت أحس بفقدان أمل . بس لأ .هفضل أدعي لغاية آخر لحظه في عمري إن أمنيتي تتحقق . ان شاء الله هتتحقق .,بدأت أشعر بفقدان الأمل، لكن لا، سأستمر في الدعاء حتى آخر لحظة في عمري حتى تتحقق أمنيتي. ستتحقق إن شاء الله.
حقيقه .مش هنفع تغني وانت مضايق .,حقيقة، لا يمكنك الغناء وأنت متضايق.
معظم الصامتين لديهم الكثير ليقولوه .ولكنهم لم يجدوا الاذن المناسبة .,معظم الصامتين لديهم الكثير ليقولوه، لكنهم لم يجدوا الأذن المناسبة.
افرحي بيا يامه .,افرحي بي يا أمي.
عار علينا ان يحبطنا اليأس .ولنا عقول واعية .,عار علينا أن يحبطنا اليأس، ولنا عقول واعية.
نفسي يجي يعلمني الرقص .,أريد أن يأتي أحد ويعلمني الرقص.
عصفور طار من الشباك .,عصفور طار من الشباك.
اشياء عجزت اتعلمها .,أشياء عجزت عن تعلمها.
اكره منظر الرجالة اللى بترقص باليه .,أكره منظر الرجال الذين يرقصون باليه.
الموسيقى دى هتنيمنى بقى .,هذه الموسيقى ستجعلني أنام الآن.
يا الله نفسي في فانوس رمضان .,يا الله، نفسي في فانوس رمضان.
النهارده عندي امتحان رياضه .ربنا يستر بكرهها اوي.,اليوم لدي امتحان رياضة. يا رب استر، أكرهها جداً.
نفسي حد ينفيني لفرنسا او تركيا .,أريد أن ينفيني أحد إلى فرنسا أو تركيا.
التمثال يا اختي اتكسر والمفروض يتجبس . وده بقي هيتجبس جبس زينا ولا نلزقه بامير .,التمثال يا أختي انكسر ومن المفترض أن نجبره. هل سنضمد الجرح كجبسنا المعتاد أم نلصقه بالصمغ؟
الجنان نفسه انك ترجع تقرا محادثه بينك وبين شخص عشان تفتكره .والموضوع يبقي حلو اوي بس بيقلب بنكد.,الجنان أنك ترجع تقرأ محادثة بينك وبين شخص لتتذكره، والموضوع يكون جميلاً جداً لكن ينتهي بحزن.
وحشتني البت دي .اللي لما كانت تشوفني مخنوقه تدخل تتكلم معايا وتقولي نكت وتفضل تضحك فيا.,اشتقت لتلك البنت. التي عندما كانت تراني متضايقاً تأتي وتتحدث معي وتقول نكات وتضحكني.
في حاجات معينة من ناس معينة ممكن تبسطنا جدا .,هناك أشياء معينة من أشخاص معينين يمكن أن تفرحنا جداً.
مش اى حد من اصحابك هتقوله انا زهقان الساعة واحدة بالليل و عاوز اخرج شوية عشر دقايق و تبقوا في الشارع .,ليس أي أحد من أصدقائك يمكن أن تقول له أنك متضايق في الساعة واحدة صباحاً وتريد الخروج قليلاً، بعد عشر دقائق ستكونون في الشارع.
في ناس لما بتناقش معاهم ببقي عايزة الكلام ميخلصش لاني بستفاد منهم جدا .,هناك أشخاص عندما أناقشهم أريد أن لا ينتهي الكلام لأنني أستفيد منهم جداً.
الملاهي هي الراعى الرسمى لخروج الطاقة المكبوتة اللى جوا الناس .,الملاهي هي الراعي الرسمي لإخراج الطاقة المكبوتة داخل الناس.
انهاردة نمت كتير اوي بالنهار مش عارف هنام بليل ازاي .,اليوم نمت كثيراً في النهار، لا أعرف كيف سأنام في الليل.
محاولات نوم فاشله.,محاولات نوم فاشلة.
اجواء المباراة ستكون الاجواء يوم السبت ال من ابريل على الشكل التالي درجة الحرارة درجات مئوية ممطر.,أجواء المباراة ستكون يوم السبت في أبريل على الشكل التالي: درجة الحرارة درجات مئوية ممطر.
كلكم كاذبون.,كلكم كاذبون.
اشتقت لايام مضت. بس الوقت والانتظار مرهق جدا .,اشتقت لأيام مضت. لكن الوقت والانتظار مرهق جداً.
بقيت لما ببعد عن اي حد بمسح المحادثه بتاعت الواتس والماسنجر. عشان منكدش علي نفسي .,عندما أبتعد عن أي شخص، أحذف المحادثة من الواتساب والماسنجر حتى لا أحزن نفسي.
عيب يا انسه. متشتميش في الكومنتات.,عيب يا آنسة، لا تشتمي في التعليقات.
لو مرة دارينا يبان فى عينينا. وهو الحب مبانش عليه. حقيقة مرة.,لو مرة دارينا يبان في عيوننا. وهو الحب ما بان عليه. حقيقة مرة.
انا نفسي اقابل عمار البيت اللي بتقولوا عليهم دول واقعد اتكلم معاهم عادي كده .واقولهم ازاى بتعمروا البيوت .,أريد أن أقابل عمار البيت الذين تتحدثون عنهم، وأجلس وأتحدث معهم بشكل طبيعي، وأسألهم كيف يعمرون البيوت.
